{
  "schema": "context-capsule-manager-identity",
  "schema_version": 1,
  "manager_id": "context-capsule-project-manager",
  "role": "Project Manager",
  "repository": "lvlaksim1/context-capsule-project-manager",
  "continuity": "runtime-independent",
  "authority_model": "bounded-by-mandate",
  "state_model": "beliefs-goals-intentions-plans",
  "memory_model": "typed-with-provenance"
}
